{
  "$schema": "../template.schema.json",
  "id": "saude-odontologia",
  "setor": "Odontologia (datas comemorativas / institucional leve)",
  "status": "pronto",
  "nichos": [
    "odontologia",
    "dentista",
    "consultório odontológico",
    "clínica odontológica",
    "odontopediatria",
    "ortodontia",
    "alinhador"
  ],
  "referencia": "clients/lothus-odontologia/video-01-dia-das-criancas",
  "formato": {
    "aspect": "9:16",
    "width": 1080,
    "height": 1920,
    "fps": 30
  },
  "duracao_s": 16.0,
  "cenas": [
    {
      "id": "S1",
      "papel": "gancho",
      "dur_s": 2.8125,
      "padroes": [
        "balloons-confetti",
        "kinetic-bounce-title"
      ],
      "campos": [],
      "fala": "{saudação da data} (ex.: 'Feliz Dia das Crianças!')"
    },
    {
      "id": "S2",
      "papel": "promessa",
      "dur_s": 4.21875,
      "padroes": [
        "tooth-character",
        "kinetic-bounce-title"
      ],
      "campos": [],
      "fala": "{mensagem leve da data, sem promessa clínica}"
    },
    {
      "id": "S3",
      "papel": "processo",
      "dur_s": 4.6875,
      "padroes": [
        "toothbrush-sparkle",
        "kinetic-bounce-title"
      ],
      "campos": [],
      "fala": "{dica de cuidado genérica: escovar, fio dental}"
    },
    {
      "id": "S4",
      "papel": "marca",
      "dur_s": 4.28125,
      "padroes": [
        "brand-lockup-soft",
        "balloons-confetti"
      ],
      "campos": [
        "empresa.nome",
        "empresa.contatos.instagram",
        "empresa.cidade",
        "marca.logo"
      ],
      "fala": "Com carinho, {empresa.nome}."
    }
  ],
  "voz": {
    "tipo": "feminina, calorosa, sorridente, pt-BR",
    "gemini_voz": "Sulafat",
    "estilo": "Voz feminina brasileira, calorosa e sorridente, como uma dentista querida falando com crianças e com os pais: alegre, acolhedora, natural, ritmo leve e sem pressa, sem exagero infantil."
  },
  "musica": {
    "bpm": 128,
    "mood": "festivo infantil (kick 4/4, palmas+caixa, pandeirola, marimba, glockenspiel, viradas nos cortes)",
    "secoes": "groove até o último acorde · outro com 'ta-dá' logo depois da última fala"
  },
  "paleta_padrao": {
    "ink": "#3d3834",
    "background": "#fbf7f2",
    "playful": [
      "#ff6b6b",
      "#ffd23f",
      "#4ecdc4",
      "#5aa9e6",
      "#b388eb"
    ]
  },
  "tom": "Acolhedor, lúdico e familiar; fala com pais e crianças; nada de jargão clínico",
  "transicoes": [
    "wipe de disco colorido (o primeiro plano vira a transição)"
  ],
  "cuidados": [
    "CFO: sem promessa de resultado, sem antes/depois, sem preço/desconto em publicidade odontológica",
    "Não citar nota/avaliações nem marcas de terceiros (ex.: Invisalign) sem confirmação",
    "Imagem de crianças reais só com autorização do responsável",
    "Não recriar o logo: sem arquivo em alta, usar lockup de texto",
    "Telefone/endereço só se confirmados pela clínica"
  ],
  "composicao": {
    "dir": "composition",
    "entrada": "index.template.html",
    "cenas": [
      "s1",
      "s2",
      "s3",
      "s4"
    ],
    "blocos": [
      "bg",
      "x0",
      "s1-balloons",
      "s1-words",
      "s1-burst",
      "x1",
      "s2-tooth",
      "s2-words",
      "s2-burst",
      "x2",
      "s3-brush",
      "s3-words",
      "s3-burst",
      "x3",
      "s4-lockup",
      "s4-words",
      "s4-confetti",
      "s4-burst"
    ],
    "_doc": "v2 dinâmica: bg (bg-parallax, vídeo inteiro) e x0 (fx-transition de abertura) ficam na s1; x1/x2/x3 (fx-transition, host começa 0,2 s antes do corte: at = 0.2) ficam na cena que entra. Por cena: bloco principal + <cena>-words (kinetic-words, times: '{{words:<fala>}}') + <cena>-burst (beat-burst, bpm: '{{bpm}}'). Durações de cena em batidas inteiras (60/bpm) para os cortes caírem na batida; câmera (punch/whip/zoom/z-punch) no template."
  }
}
