{
  "$schema": "../template.schema.json",
  "id": "saude-odontologia",
  "setor": "Odontologia (datas comemorativas / institucional leve)",
  "status": "pronto",
  "nichos": [
    "odontologia",
    "dentista",
    "consultório odontológico",
    "clínica odontológica",
    "odontopediatria",
    "ortodontia",
    "alinhador"
  ],
  "referencia": "clients/lothus-odontologia/video-01-dia-das-criancas",
  "formato": {
    "aspect": "9:16",
    "width": 1080,
    "height": 1920,
    "fps": 30
  },
  "duracao_s": 15.0,
  "cenas": [
    {
      "id": "S1",
      "papel": "gancho",
      "dur_s": 3.5,
      "padroes": [
        "balloons-confetti",
        "kinetic-bounce-title"
      ],
      "campos": [],
      "fala": "{saudação da data} (ex.: 'Feliz Dia das Crianças!')"
    },
    {
      "id": "S2",
      "papel": "promessa",
      "dur_s": 4.0,
      "padroes": [
        "tooth-character",
        "kinetic-bounce-title"
      ],
      "campos": [],
      "fala": "{mensagem leve da data, sem promessa clínica}"
    },
    {
      "id": "S3",
      "papel": "processo",
      "dur_s": 3.5,
      "padroes": [
        "toothbrush-sparkle",
        "kinetic-bounce-title"
      ],
      "campos": [],
      "fala": "{dica de cuidado genérica: escovar, fio dental}"
    },
    {
      "id": "S4",
      "papel": "marca",
      "dur_s": 4.0,
      "padroes": [
        "brand-lockup-soft",
        "balloons-confetti"
      ],
      "campos": [
        "empresa.nome",
        "empresa.contatos.instagram",
        "empresa.cidade",
        "marca.logo"
      ],
      "fala": "Com carinho, {empresa.nome}."
    }
  ],
  "voz": {
    "tipo": "feminina, calorosa, sorridente, pt-BR",
    "gemini_voz": "Sulafat",
    "estilo": "Voz feminina brasileira, calorosa e sorridente, como uma dentista querida falando com crianças e com os pais: alegre, acolhedora, natural, ritmo leve e sem pressa, sem exagero infantil."
  },
  "musica": {
    "bpm": 120,
    "mood": "infantil alegre (marimba, glockenspiel, palmas)",
    "secoes": "intro 0–3.5 · verso 3.5–11 · final 11–15 com acorde sustentado"
  },
  "paleta_padrao": {
    "ink": "#3d3834",
    "background": "#fbf7f2",
    "playful": [
      "#ff6b6b",
      "#ffd23f",
      "#4ecdc4",
      "#5aa9e6",
      "#b388eb"
    ]
  },
  "tom": "Acolhedor, lúdico e familiar; fala com pais e crianças; nada de jargão clínico",
  "transicoes": [
    "wipe de disco colorido (o primeiro plano vira a transição)"
  ],
  "cuidados": [
    "CFO: sem promessa de resultado, sem antes/depois, sem preço/desconto em publicidade odontológica",
    "Não citar nota/avaliações nem marcas de terceiros (ex.: Invisalign) sem confirmação",
    "Imagem de crianças reais só com autorização do responsável",
    "Não recriar o logo: sem arquivo em alta, usar lockup de texto",
    "Telefone/endereço só se confirmados pela clínica"
  ],
  "composicao": {
    "dir": "composition",
    "entrada": "index.template.html",
    "cenas": [
      "s1",
      "s2",
      "s3",
      "s4"
    ],
    "blocos": [
      "s1-balloons",
      "s1-title",
      "s2-tooth",
      "s2-title",
      "s3-brush",
      "s3-title",
      "s4-lockup",
      "s4-confetti"
    ],
    "_doc": "Blocos da biblioteca montados por cena; params vêm de cenas[].motion[].params (bloco = id do placeholder {{vars:<bloco>}}). Cenas: s1 saudação, s2 mascote, s3 dica, s4 marca. Títulos duram 3 s (entram em t+0,45/0,7/0,1); s1 e s3 precisam de >= 3,5 s, s2 >= 3,7 s, s4 >= 3,5 s."
  }
}
